{
  "asserted": {
    "active_work_package": {
      "effective_at": "2026-09-03T00:00:00+07:00",
      "evidence": "operator instruction, recorded in DEC-021",
      "issuer": "operator",
      "revoked_at": null,
      "valid_until": null,
      "value": "BIZTRUST-GUIDE-WP-024"
    },
    "documentation_authority": {
      "effective_at": "2026-09-03T00:00:00+07:00",
      "evidence": "user request 2026-09-03",
      "issuer": "operator",
      "revoked_at": null,
      "valid_until": null,
      "value": "GRANTED"
    }
  },
  "computed": {
    "freshness": "UNKNOWN",
    "next_action": {
      "action": "Author and seal the nine WP-024 fixtures and oracles.",
      "authority": "GRANTED_BY_USER_REQUEST_2026_09_03",
      "id": "NS-030",
      "requires": [
        "observed.main_sha",
        "asserted.documentation_authority",
        "asserted.active_work_package"
      ]
    },
    "resume_decision": "CONTINUE",
    "stop_conditions": []
  },
  "declared_non_coverage": [
    "This artifact does not establish that the derivation is correct.",
    "It makes no claim about work not represented in observed or asserted."
  ],
  "derived_at": "2026-09-04T09:00:00+07:00",
  "observed": {
    "ci_conclusion": {
      "freshness": "UNKNOWN",
      "observed_at": null,
      "source": "GET https://api.github.com/repos/bstBizEra/biztrust_guide/commits/e23143ef91dcf0fd03e1686a1b2880c0696b798d/check-runs - 503",
      "value": null
    },
    "issue_2_labels": {
      "freshness": "CURRENT",
      "observed_at": "2026-09-04T09:00:00+07:00",
      "source": "GET https://api.github.com/repos/bstBizEra/biztrust_guide/issues/2",
      "value": []
    },
    "issue_2_state": {
      "freshness": "CURRENT",
      "observed_at": "2026-09-04T09:00:00+07:00",
      "source": "GET https://api.github.com/repos/bstBizEra/biztrust_guide/issues/2",
      "value": "closed"
    },
    "main_sha": {
      "freshness": "CURRENT",
      "observed_at": "2026-09-04T09:00:00+07:00",
      "source": "git rev-parse HEAD",
      "value": "e23143ef91dcf0fd03e1686a1b2880c0696b798d"
    },
    "open_pull_requests": {
      "freshness": "CURRENT",
      "observed_at": "2026-09-04T09:00:00+07:00",
      "source": "GET https://api.github.com/repos/bstBizEra/biztrust_guide/pulls?state=open",
      "value": 0
    },
    "pages_status": {
      "freshness": "UNKNOWN",
      "observed_at": null,
      "source": "GET https://api.github.com/repos/bstBizEra/biztrust_guide/pages - 503",
      "value": null
    }
  },
  "schema_version": "3.0.0",
  "source_sha": "e23143ef91dcf0fd03e1686a1b2880c0696b798d",
  "static": {
    "deriver_policy_version": "0.1.0-fixture",
    "project_id": "BIZTRUST-GUIDE",
    "repository": {
      "name": "biztrust_guide",
      "owner": "bstBizEra",
      "remote": "https://github.com/bstBizEra/biztrust_guide"
    }
  }
}
